[
  { "id": "consultants_case_01_role_modern_hair_restoration", "programId": "program_certificate_consultation_patient_coordination", "moduleId": "consultants_module_01_role_modern_hair_restoration", "slug": "case-role-boundary-clarity", "title": "Role Boundary Clarity", "status": "draft", "scenarioSummary": "A new patient asks the coordinator for a diagnosis before doctor review.", "patientContext": "First-contact enquiry with expectation of immediate certainty.", "redFlags": ["Request for diagnosis from non-doctor staff"], "discussionPrompts": ["What should be explained?", "What should be avoided?"], "expectedEscalationPath": "Clarify role and route to doctor review.", "linkedCompetencyIds": ["consultants_competency_01_role_scope_foundations"], "facultyNoteIds": ["consultants_note_scope_language"], "referenceIds": ["consultants_reference_01"] },
  { "id": "consultants_case_02_foundations_hair_scalp_science", "programId": "program_certificate_consultation_patient_coordination", "moduleId": "consultants_module_02_foundations_hair_scalp_science", "slug": "case-basic-biological-explanation", "title": "Basic Biological Explanation", "status": "draft", "scenarioSummary": "A patient asks why shedding may fluctuate over time.", "patientContext": "Routine discussion requiring clear educational language.", "redFlags": ["Overstating certainty from limited information"], "discussionPrompts": ["How can cycle language help?", "What should remain clinician-led?"], "expectedEscalationPath": "Use general education and escalate personalised interpretation if needed.", "linkedCompetencyIds": ["consultants_competency_02_hair_scalp_literacy"], "facultyNoteIds": [], "referenceIds": ["consultants_reference_02"] },
  { "id": "consultants_case_03_common_hair_loss_presentations", "programId": "program_certificate_consultation_patient_coordination", "moduleId": "consultants_module_03_common_hair_loss_presentations", "slug": "case-atypical-presentation", "title": "Atypical Presentation", "status": "draft", "scenarioSummary": "A patient reports rapid change and visible scalp irritation.", "patientContext": "Presentation appears outside routine expectations.", "redFlags": ["Rapid change", "Visible inflammation"], "discussionPrompts": ["How should this be documented?", "What should not be said?"], "expectedEscalationPath": "Immediate clinician review pathway.", "linkedCompetencyIds": ["consultants_competency_03_presentation_literacy"], "facultyNoteIds": [], "referenceIds": ["consultants_reference_03"] },
  { "id": "consultants_case_04_consultation_structure_information_gathering", "programId": "program_certificate_consultation_patient_coordination", "moduleId": "consultants_module_04_consultation_structure_information_gathering", "slug": "case-structured-history-taking", "title": "Structured History Taking", "status": "draft", "scenarioSummary": "A first consultation is drifting into unsystematic conversation.", "patientContext": "Important history is at risk of being missed.", "redFlags": ["Unstructured note capture"], "discussionPrompts": ["How can structure be restored?", "Which headings matter most?"], "expectedEscalationPath": "Return to standard structure and document any concerns.", "linkedCompetencyIds": ["consultants_competency_04_structured_information_gathering"], "facultyNoteIds": [], "referenceIds": ["consultants_reference_04"] },
  { "id": "consultants_case_05_candidate_screening_suitability_support", "programId": "program_certificate_consultation_patient_coordination", "moduleId": "consultants_module_05_candidate_screening_suitability_support", "slug": "case-suitability-boundary", "title": "Suitability Boundary", "status": "draft", "scenarioSummary": "A patient pushes for confirmation of candidacy before doctor review.", "patientContext": "Screening information is incomplete and expectation is high.", "redFlags": ["Expectation mismatch", "Pressure to commit"], "discussionPrompts": ["What can be documented?", "What must be escalated?"], "expectedEscalationPath": "Doctor review before any suitability statement.", "linkedCompetencyIds": ["consultants_competency_05_candidate_screening_support"], "facultyNoteIds": [], "referenceIds": ["consultants_reference_05"] },
  { "id": "consultants_case_06_ethics_consent_scope_of_practice", "programId": "program_certificate_consultation_patient_coordination", "moduleId": "consultants_module_06_ethics_consent_scope_of_practice", "slug": "case-consent-pressure", "title": "Consent Pressure", "status": "draft", "scenarioSummary": "A patient asks a consultant whether they should sign now before meeting the doctor.", "patientContext": "Commercial pressure is present.", "redFlags": ["Pressure-selling risk"], "discussionPrompts": ["What language is safe?", "How should the issue be escalated?"], "expectedEscalationPath": "Stop pressure and route to doctor-led consent discussion.", "linkedCompetencyIds": ["consultants_competency_06_ethics_scope_consent_support"], "facultyNoteIds": ["consultants_note_scope_language"], "referenceIds": ["consultants_reference_06"] },
  { "id": "consultants_case_07_communication_excellence_trust_based_consultation", "programId": "program_certificate_consultation_patient_coordination", "moduleId": "consultants_module_07_communication_excellence_trust_based_consultation", "slug": "case-trust-based-response", "title": "Trust-Based Response", "status": "draft", "scenarioSummary": "A hesitant patient wants immediate certainty and reassurance.", "patientContext": "The patient is anxious but not yet ready for clinical decision-making.", "redFlags": ["Over-reassurance risk"], "discussionPrompts": ["How can trust be preserved?", "What should not be promised?"], "expectedEscalationPath": "Use calm communication and route clinician questions appropriately.", "linkedCompetencyIds": ["consultants_competency_07_patient_communication"], "facultyNoteIds": [], "referenceIds": ["consultants_reference_07"] },
  { "id": "consultants_case_08_non_surgical_treatment_education", "programId": "program_certificate_consultation_patient_coordination", "moduleId": "consultants_module_08_non_surgical_treatment_education", "slug": "case-non-surgical-options", "title": "Non-Surgical Options Education", "status": "draft", "scenarioSummary": "A patient wants help understanding non-surgical options before review.", "patientContext": "The patient needs education, not prescribing advice.", "redFlags": ["Drifting into recommendation"], "discussionPrompts": ["How should options be explained?", "Where is the boundary?"], "expectedEscalationPath": "Escalate personalised treatment questions to the clinician.", "linkedCompetencyIds": ["consultants_competency_08_non_surgical_education"], "facultyNoteIds": [], "referenceIds": ["consultants_reference_08"] },
  { "id": "consultants_case_09_surgical_education_for_non_doctors", "programId": "program_certificate_consultation_patient_coordination", "moduleId": "consultants_module_09_surgical_education_for_non_doctors", "slug": "case-surgical-pathway-overview", "title": "Surgical Pathway Overview", "status": "draft", "scenarioSummary": "A patient asks what surgery usually involves and whether they are likely to qualify.", "patientContext": "Pathway education is needed but suitability is clinician-led.", "redFlags": ["Planning claims by non-doctor staff"], "discussionPrompts": ["What can be explained safely?", "What requires doctor review?"], "expectedEscalationPath": "Provide pathway overview and route personalised questions onward.", "linkedCompetencyIds": ["consultants_competency_09_surgical_pathway_education"], "facultyNoteIds": [], "referenceIds": ["consultants_reference_09"] },
  { "id": "consultants_case_10_clinical_photography_documentation_handover", "programId": "program_certificate_consultation_patient_coordination", "moduleId": "consultants_module_10_clinical_photography_documentation_handover", "slug": "case-handover-quality", "title": "Handover Quality", "status": "draft", "scenarioSummary": "A doctor reports that a case handover was unclear and incomplete.", "patientContext": "Documentation quality is affecting workflow efficiency.", "redFlags": ["Missing neutral detail", "Poor image capture"], "discussionPrompts": ["Which information was missing?", "How can standards be improved?"], "expectedEscalationPath": "Correct documentation and follow clinic QA process.", "linkedCompetencyIds": ["consultants_competency_10_documentation_handover"], "facultyNoteIds": ["consultants_note_documentation_standard"], "referenceIds": ["consultants_reference_10"] },
  { "id": "consultants_case_11_pre_operative_coordination_preparation", "programId": "program_certificate_consultation_patient_coordination", "moduleId": "consultants_module_11_pre_operative_coordination_preparation", "slug": "case-pre-op-readiness-gap", "title": "Pre-Op Readiness Gap", "status": "draft", "scenarioSummary": "A patient reaches the week of treatment with missing pre-op information.", "patientContext": "Coordination failure may affect safety and scheduling.", "redFlags": ["Incomplete preparation workflow"], "discussionPrompts": ["What should happen now?", "Who must be informed?"], "expectedEscalationPath": "Pause progression and escalate to the relevant clinical or operational lead.", "linkedCompetencyIds": ["consultants_competency_11_preoperative_coordination"], "facultyNoteIds": [], "referenceIds": ["consultants_reference_11"] },